{
  "schema_version": "1",
  "report_id": "bench-20260915-003",
  "generated_at": "2026-09-15",
  "purpose": "Fourteen public small-RNA runs (SRR28573920-25, SRR8205656-63) that map near-zero against the study's mRNA reference were quantified against the miRBase mature miRNA reference (69,020 entries; salmon index k=19 with --keepDuplicates, yielding 69,019 targets - the single FASTA entry salmon cannot index is ath-miR5645d-3p, a 20 nt poly-A homopolymer). The eight 50 nt raw reads (SRR8205656-63) were 3' adapter-trimmed with the SDK (Illumina universal adapter, min-overlap 8, min-length 18) before quantification; bias correction is disabled as it is not meaningful for small-RNA fragments.",
  "methodology": {
    "backends_flag": "rust-orchestrated upstream salmon 2.7.0 (bioconda), -l A, -p 8, --validateMappings, no bias correction; adapter trim via linxira-bio fastq adapter-trim",
    "repeat_flag": "1 per run, serial batch",
    "warmup": "none",
    "page_cache": "warm",
    "disclosure": "data-property finding: SRR28573920-25 are dominated by 24-30 nt siRNA-class reads (mature-miRNA exact-substring content ~1.6%), and SRR8205656-63 inserts (34-42 nt after trimming) are longer than the 20-24 nt mature targets, so end-to-end alignment maps ~0% by construction - the quant.sf files capture the minor miRNA component; the library-type interpretation belongs to the study"
  },
  "engine": "1.0.3",
  "environment": {
    "os": "linux",
    "kernel": "7.2.3-1-cachyos",
    "cpu_model": "Intel Xeon E5-2676 v3 @ 2.40GHz (24 threads; runs pinned to cores 8-15, nice 10)",
    "total_memory_mb": 31744,
    "distro": "CachyOS (arch-based)",
    "gpu": "AMD Radeon RX 580 2048SP (Polaris 20, amdgpu kernel driver; unused by these workloads)",
    "memory": "32 GiB DDR3-1600 MT/s (2x16 GiB DIMM_B1/D1, 72-bit width)",
    "storage": "system/log: Kingston SA400S37 120 GB SSD; benchmark I/O data volume: WDC WD5000AZLX 500 GB 7200rpm HDD; bulk reference data: Seagate ST3000DM001 3 TB HDD",
    "engine_version": "1.0.3",
    "python_version": "Python 3.14 (system)",
    "r_version": null,
    "code_revision": "v1.0.3 release binary (workstation deployment, built 2026-09-14) + post-release ops scripts",
    "in_container": false,
    "page_cache": "warm",
    "precision": "second-resolution wall clock per run"
  },
  "data_sources": [
    {
      "id": "small-rna-fastq",
      "origin": "private-server",
      "reference": "study workspace fastq for SRR28573920-25 and SRR8205656-63 (public NCBI SRA accessions), read-only",
      "note": "raw 50 nt reads for SRR8205656-63; adapter-trimmed intermediates regenerated per run"
    },
    {
      "id": "mirbase-mature",
      "origin": "public-download",
      "reference": "miRBase mature.fa (69,020 entries, mirbase.org), salmon index k=19 --keepDuplicates",
      "note": "69,019 indexable targets"
    },
    {
      "id": "salmon-index-reference-unused",
      "origin": "private-server",
      "reference": "study mRNA salmon index (not used here; listed for completeness of the workstation toolchain)",
      "note": "the mRNA index is the reference these runs were originally found unmappable against"
    }
  ],
  "entries": [
    {
      "id": "mirbase-14runs-quant",
      "capability": "expression.quantify.v1",
      "dataset_class": "srr",
      "dataset": "14 runs against the miRBase mature index; every quant.sf = 69,019 rows (full indexed target set)",
      "data_source_id": "mirbase-mature",
      "status": "ok",
      "consistency": "14/14 quant.sf match the indexed target set exactly (69,019 rows); mapped fractions 0.00-0.10% reflect the libraries' small miRNA fraction, documented per run",
      "speedup": null,
      "memory_saving": null,
      "precision": "second-resolution wall clock",
      "report": null,
      "backends": {
        "rust": {
          "median_wall_ms": 4000.0,
          "median_peak_rss_mb": null,
          "ok_runs": 14,
          "repeats": 14
        }
      }
    }
  ]
}
